{
  "$schema": "../../../schemas/risk-factor-profile.schema.json",
  "profile_id": "domestic-base",
  "version": "1.0.0",
  "mode": "derived_domestic",
  "dispatch": "v2_direct",
  "applies_to": {
    "mode": "domestic"
  },
  "_notes": {
    "purpose": "Common defaults for derived_domestic profiles. Carries the 4-component skeleton in declared order [base_sofr, demand_volatility, payment_cycle, wc] with stress_timing 12/3/9 inherited from V1, 24-month quarterly tenor grid, and 250bps default loan spread. NO V1 precedent \u2014 Iter-6 introduces derived_domestic. Never used alone; sector-specific profiles (e.g. us-services.json) override these defaults via deep merge per design-v1-config-architecture.md \u00a74.",
    "merge_position": "Least specific. Loaded first by profile_resolver (Iter-6 deliverable 7 adds the domestic-aware branch); sector files override on top.",
    "dispatch_default": "v2_direct because no DRAPS path exists for derived_domestic. V2 computes the SOFR path directly via COMPONENT_REGISTRY per the composer's generalized derived branch (Iter-6 deliverable 4).",
    "component_choices": "[base_sofr, demand_volatility, payment_cycle, wc] matches design-v1-risk-factor-catalog.md \u00a7Component-to-audience-matrix 'Domestic services' column: payment_cycle_stress_dso is core; demand_volatility / wc / base_sofr universal. Iter-7 (ecommerce, shipped in us-ecommerce.json) does NOT substitute or remove payment_cycle: the matrix 'Ecommerce' column keeps payment_cycle as 'yes' and adds inventory_carrying_dso_dpo as a second core driver, so ecommerce is a SUPERSET of this skeleton + inventory_carrying. It inherits this _base unchanged and appends inventory_carrying via the additive deep-merge (profile_resolver._merge_components) \u2014 no _base_ecommerce.json (a second applies_to={mode:domestic} file would collide on the 'base' layer) and no refactor of this file were needed.",
    "applies_to_mode_note": "applies_to.mode is the coarse classifier 'domestic' (schema enum). The state-side business_identity.mode (e.g. 'domestic_services') is the fine classifier; profile_resolver bridges coarse-to-fine via applies_to.industry. No naics field exists on the profile schema; NAICS lives in state."
  },
  "components": [
    {
      "name": "base_sofr",
      "formula_id": "base_sofr_fed_path_linear",
      "inputs": {
        "months_to_peak": 12,
        "total_months_assumption": 24
      }
    },
    {
      "name": "demand_volatility",
      "formula_id": "demand_volatility_vix_proxy",
      "inputs": {
        "pmi_neutral": 50.0,
        "sensitivity_bps_per_point": 4.0,
        "baseline_bps": 5.0,
        "decay_months": 6
      }
    },
    {
      "name": "payment_cycle",
      "formula_id": "payment_cycle_stress_dso",
      "inputs": {
        "sensitivity_bps_per_day": 1.5,
        "baseline_bps": 2.0,
        "stress_timing": {
          "months_to_peak": 12,
          "plateau_months":  3,
          "descent_months":  9
        }
      }
    },
    {
      "name": "wc",
      "formula_id": "wc_trapezoidal",
      "inputs": {
        "stress_timing": {
          "months_to_peak": 12,
          "plateau_months":  3,
          "descent_months":  9
        }
      }
    }
  ],
  "loan_spread_default": 0.025,
  "tenor_grid": {
    "kind": "quarterly",
    "horizon_months": 24,
    "anchor": "loan_start_date"
  }
}
